{
  "schema_version": "1.0",
  "run_id": "20261005T030307Z-baseline",
  "generated_at": "2026-10-05T03:07:17Z",
  "results": [
    {
      "host": "lab-bastion",
      "control_id": "HL-SSH-001",
      "status": "fail",
      "severity": "high",
      "exception_id": null,
      "sources": [
        "lab-probe:assert:HL-SSH-001:1",
        "lynis:SSH-7408",
        "openscap:sshd_disable_root_login"
      ],
      "evidence": [
        {
          "path": "evidence/lab-bastion/sshd_effective.txt",
          "sha256": "5391768b8b183d8e941d8916e728f6966f24be6f18b7280ea81dee13c0f5a5d6",
          "method": "examine"
        }
      ]
    },
    {
      "host": "lab-bastion",
      "control_id": "HL-SSH-002",
      "status": "fail",
      "severity": "high",
      "exception_id": null,
      "sources": [
        "lab-probe:assert:HL-SSH-002:1",
        "openscap:sshd_disable_empty_passwords"
      ],
      "evidence": [
        {
          "path": "evidence/lab-bastion/sshd_effective.txt",
          "sha256": "5391768b8b183d8e941d8916e728f6966f24be6f18b7280ea81dee13c0f5a5d6",
          "method": "examine"
        }
      ]
    },
    {
      "host": "lab-bastion",
      "control_id": "HL-SSH-003",
      "status": "fail",
      "severity": "medium",
      "exception_id": null,
      "sources": [
        "lab-probe:assert:HL-SSH-003:1",
        "lab-probe:assert:HL-SSH-003:2",
        "openscap:sshd_use_strong_ciphers",
        "openscap:sshd_use_strong_kex",
        "openscap:sshd_use_strong_macs"
      ],
      "evidence": [
        {
          "path": "evidence/lab-bastion/sshd_effective.txt",
          "sha256": "5391768b8b183d8e941d8916e728f6966f24be6f18b7280ea81dee13c0f5a5d6",
          "method": "examine"
        }
      ]
    },
    {
      "host": "lab-bastion",
      "control_id": "HL-SSH-004",
      "status": "fail",
      "severity": "medium",
      "exception_id": null,
      "sources": [
        "lab-probe:assert:HL-SSH-004:1",
        "lab-probe:assert:HL-SSH-004:2",
        "lynis:SSH-7408",
        "openscap:sshd_set_login_grace_time",
        "openscap:sshd_set_max_auth_tries",
        "openscap:sshd_set_max_sessions",
        "openscap:sshd_set_maxstartups"
      ],
      "evidence": [
        {
          "path": "evidence/lab-bastion/sshd_effective.txt",
          "sha256": "5391768b8b183d8e941d8916e728f6966f24be6f18b7280ea81dee13c0f5a5d6",
          "method": "examine"
        }
      ]
    },
    {
      "host": "lab-bastion",
      "control_id": "HL-SSH-005",
      "status": "exception",
      "severity": "medium",
      "exception_id": "EXC-007",
      "sources": [
        "lab-probe:assert:HL-SSH-005:1",
        "lab-probe:assert:HL-SSH-005:2",
        "lynis:SSH-7408"
      ],
      "evidence": [
        {
          "path": "evidence/lab-bastion/sshd_effective.txt",
          "sha256": "5391768b8b183d8e941d8916e728f6966f24be6f18b7280ea81dee13c0f5a5d6",
          "method": "examine"
        }
      ]
    },
    {
      "host": "lab-bastion",
      "control_id": "HL-SSH-006",
      "status": "fail",
      "severity": "medium",
      "exception_id": null,
      "sources": [
        "lab-probe:assert:HL-SSH-006:1",
        "lynis:SSH-7408",
        "openscap:sshd_set_idle_timeout",
        "openscap:sshd_set_keepalive"
      ],
      "evidence": [
        {
          "path": "evidence/lab-bastion/sshd_effective.txt",
          "sha256": "5391768b8b183d8e941d8916e728f6966f24be6f18b7280ea81dee13c0f5a5d6",
          "method": "examine"
        }
      ]
    },
    {
      "host": "lab-bastion",
      "control_id": "HL-SSH-007",
      "status": "exception",
      "severity": "low",
      "exception_id": "EXC-016",
      "sources": [
        "lab-probe:assert:HL-SSH-007:1",
        "lynis:SSH-7408",
        "openscap:sshd_set_loglevel_info"
      ],
      "evidence": [
        {
          "path": "evidence/lab-bastion/sshd_effective.txt",
          "sha256": "5391768b8b183d8e941d8916e728f6966f24be6f18b7280ea81dee13c0f5a5d6",
          "method": "examine"
        }
      ]
    },
    {
      "host": "lab-bastion",
      "control_id": "HL-SSH-008",
      "status": "fail",
      "severity": "medium",
      "exception_id": null,
      "sources": [
        "lab-probe:assert:HL-SSH-008:1",
        "lab-probe:assert:HL-SSH-008:2",
        "openscap:sshd_enable_warning_banner_net",
        "openscap:sshd_limit_user_access"
      ],
      "evidence": [
        {
          "path": "evidence/lab-bastion/sshd_effective.txt",
          "sha256": "5391768b8b183d8e941d8916e728f6966f24be6f18b7280ea81dee13c0f5a5d6",
          "method": "examine"
        }
      ]
    },
    {
      "host": "lab-bastion",
      "control_id": "HL-SSH-009",
      "status": "fail",
      "severity": "medium",
      "exception_id": null,
      "sources": [
        "openscap:disable_host_auth",
        "openscap:sshd_disable_rhosts",
        "openscap:sshd_do_not_permit_user_env"
      ],
      "evidence": [
        {
          "path": "evidence/lab-bastion/sshd_effective.txt",
          "sha256": "5391768b8b183d8e941d8916e728f6966f24be6f18b7280ea81dee13c0f5a5d6",
          "method": "examine"
        }
      ]
    },
    {
      "host": "lab-bastion",
      "control_id": "HL-SSH-010",
      "status": "fail",
      "severity": "medium",
      "exception_id": null,
      "sources": [
        "lab-probe:assert:HL-SSH-010:1",
        "openscap:file_permissions_sshd_config",
        "openscap:file_permissions_sshd_drop_in_config"
      ],
      "evidence": [
        {
          "path": "evidence/lab-bastion/sshd_files.txt",
          "sha256": "e369ccfd63a16beb1761dbb41da183d23652e4b9f2f2338b4ec1b1d6536fb6f3",
          "method": "examine"
        }
      ]
    },
    {
      "host": "lab-bastion",
      "control_id": "HL-SSH-011",
      "status": "fail",
      "severity": "medium",
      "exception_id": null,
      "sources": [
        "lab-probe:assert:HL-SSH-011:1"
      ],
      "evidence": [
        {
          "path": "evidence/lab-bastion/fail2ban.txt",
          "sha256": "7c213f7b9ce5d9852cdc49c75e1a56596bc5cd72fb344fa1de557c0d881d6039",
          "method": "examine"
        }
      ]
    },
    {
      "host": "lab-bastion",
      "control_id": "HL-ACC-001",
      "status": "fail",
      "severity": "medium",
      "exception_id": null,
      "sources": [
        "lab-probe:assert:HL-ACC-001:1",
        "lab-probe:assert:HL-ACC-001:2",
        "lynis:AUTH-9286",
        "openscap:account_disable_post_pw_expiration",
        "openscap:accounts_maximum_age_login_defs"
      ],
      "evidence": [
        {
          "path": "evidence/lab-bastion/accounts.txt",
          "sha256": "85552ccc64f77d6d43c26724073e89b9d22198d1f0a4544e038d3c195511b67d",
          "method": "examine"
        }
      ]
    },
    {
      "host": "lab-bastion",
      "control_id": "HL-ACC-002",
      "status": "fail",
      "severity": "medium",
      "exception_id": null,
      "sources": [
        "lab-probe:assert:HL-ACC-002:1",
        "lynis:AUTH-9230"
      ],
      "evidence": [
        {
          "path": "evidence/lab-bastion/accounts.txt",
          "sha256": "85552ccc64f77d6d43c26724073e89b9d22198d1f0a4544e038d3c195511b67d",
          "method": "examine"
        }
      ]
    },
    {
      "host": "lab-bastion",
      "control_id": "HL-ACC-003",
      "status": "pass",
      "severity": "medium",
      "exception_id": null,
      "sources": [
        "openscap:no_invalid_shell_accounts_unlocked",
        "openscap:no_shelllogin_for_systemaccounts"
      ],
      "evidence": [
        {
          "path": "evidence/lab-bastion/accounts.txt",
          "sha256": "85552ccc64f77d6d43c26724073e89b9d22198d1f0a4544e038d3c195511b67d",
          "method": "examine"
        }
      ]
    },
    {
      "host": "lab-bastion",
      "control_id": "HL-ACC-004",
      "status": "fail",
      "severity": "high",
      "exception_id": null,
      "sources": [
        "openscap:root_path_all_dirs"
      ],
      "evidence": [
        {
          "path": "evidence/lab-bastion/accounts.txt",
          "sha256": "85552ccc64f77d6d43c26724073e89b9d22198d1f0a4544e038d3c195511b67d",
          "method": "examine"
        }
      ]
    },
    {
      "host": "lab-bastion",
      "control_id": "HL-ACC-005",
      "status": "fail",
      "severity": "medium",
      "exception_id": null,
      "sources": [
        "lab-probe:assert:HL-ACC-005:1",
        "lynis:AUTH-9328",
        "openscap:accounts_tmout",
        "openscap:accounts_umask_etc_bashrc",
        "openscap:accounts_umask_etc_login_defs",
        "openscap:accounts_umask_etc_profile"
      ],
      "evidence": [
        {
          "path": "evidence/lab-bastion/accounts.txt",
          "sha256": "85552ccc64f77d6d43c26724073e89b9d22198d1f0a4544e038d3c195511b67d",
          "method": "examine"
        }
      ]
    },
    {
      "host": "lab-bastion",
      "control_id": "HL-ACC-006",
      "status": "fail",
      "severity": "high",
      "exception_id": null,
      "sources": [
        "lab-probe:assert:HL-ACC-006:1"
      ],
      "evidence": [
        {
          "path": "evidence/lab-bastion/sudoers.txt",
          "sha256": "b8111d90cc4fb6a014440f1874b970faf9419de76f519b41c2a74db61915d2bf",
          "method": "examine"
        }
      ]
    },
    {
      "host": "lab-bastion",
      "control_id": "HL-SUDO-001",
      "status": "fail",
      "severity": "medium",
      "exception_id": null,
      "sources": [
        "lab-probe:assert:HL-SUDO-001:2",
        "openscap:sudo_custom_logfile"
      ],
      "evidence": [
        {
          "path": "evidence/lab-bastion/sudoers.txt",
          "sha256": "b8111d90cc4fb6a014440f1874b970faf9419de76f519b41c2a74db61915d2bf",
          "method": "examine"
        }
      ]
    },
    {
      "host": "lab-bastion",
      "control_id": "HL-SUDO-002",
      "status": "fail",
      "severity": "medium",
      "exception_id": null,
      "sources": [